OID_,HierarchyKey,GeoMaterial,IndentedName,Definition
1,01,Sedimentary material,Sedimentary material,"An aggregation of particles deposited by gravity, air, water, or ice, or as accumulated by other natural agents operating at Earths surface such as chemical precipitation or secretion by organisms. May include unconsolidated material (sediment) and (or) sedimentary rock. Does not include sedimentary material directly deposited as a result of volcanic activity."
2,01.01,Sediment,--Sediment,"Unconsolidated material (sediment) composed of particles deposited by gravity, air, water, or ice, or as accumulated by other natural agents operating at Earths surface such as chemical precipitation or secretion by organisms. Does not include sedimentary material directly deposited as a result of volcanic activity."
3,01.01.01,Clastic sediment,----Clastic sediment,"Sediment formed by weathering and erosion of preexisting rocks or minerals; eroded particles or clasts are transported and deposited by gravity, air, water, or ice."
4,01.01.01.01,Sand and gravel of unspecified origin,------Sand and gravel of unspecified origin,"Sediment composed mostly of sand and (or) gravel, formed by weathering and erosion of preexisting rocks or minerals; eroded particles or clasts are transported and deposited by gravity, air, water, or ice."
5,01.01.01.02,Silt and clay of unspecified origin,------Silt and clay of unspecified origin,"Sediment composed mostly of silt and (or) clay, formed by weathering and erosion of preexisting rocks or minerals; eroded particles or clasts are transported and deposited by gravity, air, water, or ice."
6,01.01.01.03,Alluvial sediment,------Alluvial sediment,"Unconsolidated material deposited by streams or other bodies of running water as sorted or semisorted sediment in streambed, or on its floodplain or delta, or as cone or fan at base of mountain slope. Grain size varies from clay to gravel."
7,01.01.01.03.01,"Alluvial sediment, mostly coarse-grained","--------Alluvial sediment, mostly coarse-grained","Unconsolidated material deposited by streams or other bodies of running water as sorted or semisorted sediment in streambed, or on its floodplain or delta, or as cone or fan at base of mountain slope. Sediment is mostly sand, gravel, and coarser material but may also contain some silt and clay."
8,01.01.01.03.02,"Alluvial sediment, mostly fine-grained","--------Alluvial sediment, mostly fine-grained","Unconsolidated material deposited by streams or other bodies of running water as sorted or semisorted sediment in streambed, or on its floodplain or delta, or as cone or fan at base of mountain slope. Sediment is mostly silt and clay but may also contain some sand and gravel."
9,01.01.01.04,Glacial till,------Glacial till,"Mostly unsorted and unstratified material, generally unconsolidated, deposited directly by and underneath or adjacent to glacier without subsequent reworking by meltwater. Consists of heterogeneous mixture of clay, silt, sand, gravel, and boulders, ranging widely in size and shape."
10,01.01.01.04.01,"Glacial till, mostly sandy","--------Glacial till, mostly sandy","Mostly unsorted and unstratified material, generally unconsolidated, deposited directly by and underneath or adjacent to glacier without subsequent reworking by meltwater. Consists of heterogeneous mixture of clay, silt, sand, gravel, and boulders, ranging widely in size and shape. Relatively sandy in texture."
11,01.01.01.04.02,"Glacial till, mostly silty","--------Glacial till, mostly silty","Mostly unsorted and unstratified material, generally unconsolidated, deposited directly by and underneath or adjacent to glacier without subsequent reworking by meltwater. Consists of heterogeneous mixture of clay, silt, sand, gravel, and boulders, ranging widely in size and shape. Relatively loamy (silty) in texture."
12,01.01.01.04.03,"Glacial till, mostly clayey","--------Glacial till, mostly clayey","Mostly unsorted and unstratified material, generally unconsolidated, deposited directly by and underneath or adjacent to glacier without subsequent reworking by meltwater. Consists of heterogeneous mixture of clay, silt, sand, gravel, and boulders, ranging widely in size and shape. Relatively clayey in texture."
13,01.01.01.05,Ice-contact and ice-marginal sediment,------Ice-contact and ice-marginal sediment,"Mostly sand-, silt-, and gravel-sized particles or clasts derived from rock or preexisting sediment that has been eroded and transported by glaciers. As glacier melted, material was deposited by running water essentially in contact with glacial ice or was transported and deposited by glacially fed streams. Includes sediment deposited into water bodies adjacent to glacier."
14,01.01.01.05.01,"Ice-contact and ice-marginal sediment, mostly coarse-grained","--------Ice-contact and ice-marginal sediment, mostly coarse-grained","Mostly sand- and gravel-sized particles or clasts, with lesser amounts of silt and clay, derived from rock or preexisting sediment that has been eroded and transported by glaciers. As glacier melted, material was deposited by running water essentially in contact with glacial ice or was transported and deposited by glacially fed streams. Includes sediment deposited into water bodies adjacent to glacier."
15,01.01.01.05.02,"Ice-contact and ice-marginal sediment, mostly fine-grained","--------Ice-contact and ice-marginal sediment, mostly fine-grained","Mostly silt- and clay-sized particles or clasts, with lesser amounts of sand and gravel, derived from rock or preexisting sediment that has been eroded and transported by glaciers. As glacier melted, material was deposited by running water essentially in contact with glacial ice or was transported and deposited by glacially fed streams. Includes sediment deposited into water bodies adjacent to glacier."
16,01.01.01.06,Eolian sediment,------Eolian sediment,"Silt- and sand-sized sediment, deposited by wind."
17,01.01.01.06.01,Dune sand,--------Dune sand,"Mostly sand-sized sediment, deposited by wind. Typically characterized by various dune landforms."
18,01.01.01.06.02,Loess,--------Loess,"Silty sediment, deposited by wind, commonly near glacial margin."
19,01.01.01.07,Lacustrine sediment,------Lacustrine sediment,"Mostly well-sorted and well-bedded material that ranges in grain size from clay to gravel, deposited in perennial to intermittent lakes. Much of sediment is derived from material eroded and transported by streams. Includes deposits of lake-marginal beaches and deltas."
20,01.01.01.07.01,"Lacustrine sediment, mostly coarse-grained","--------Lacustrine sediment, mostly coarse-grained","Mostly well-sorted and well-bedded material, generally sand and gravel sized, with lesser amounts of silt and clay, deposited in perennial to intermittent lakes. Much of sediment is derived from material eroded and transported by streams. Mostly deposits of lake-marginal beaches and deltas."
21,01.01.01.07.02,"Lacustrine sediment, mostly fine-grained","--------Lacustrine sediment, mostly fine-grained","Mostly well-sorted and well-bedded material, generally silt and clay sized, with lesser amounts of sand, deposited in perennial to intermittent lakes. "
22,01.01.01.08,Playa sediment,------Playa sediment,"Fine-grained clastic sediment and evaporitic salts, deposited in ephemeral lakes in centers of undrained basins. Includes material deposited in playas, mud flats, salt flats, and adjacent saline marshes. Generally interbedded with eolian sand and with lacustrine sediment deposited during wetter climatic periods; commonly intertongues upslope with sediment deposited by alluvial fans."
23,01.01.01.09,Coastal zone sediment,------Coastal zone sediment,"Mud and sand, with lesser amounts of gravel, deposited on beaches, on barrier islands, or in nearshore-marine, deltaic, or various low-energy shoreline (mud flat, tidal flat, sabka, algal flat) environments."
24,01.01.01.09.01,"Coastal zone sediment, mostly coarse-grained","--------Coastal zone sediment, mostly coarse-grained","Mostly sand, silt, and gravel, deposited on beaches, in dunes, and in shallow-marine and related alluvial environments."
25,01.01.01.09.02,"Coastal zone sediment, mostly fine-grained","--------Coastal zone sediment, mostly fine-grained","Mostly clay and silt, deposited in lagoons, tidal flats, backbarriers, and coastal marshes."
26,01.01.01.10,Marine sediment,------Marine sediment,"Mud and sand, deposited in various marine environments. May originate from erosion of rocks and sediment or may be derived from marine organisms (of carbonate or siliceous composition)."
27,01.01.01.10.01,"Marine sediment, mostly coarse-grained","--------Marine sediment, mostly coarse-grained","Mud, sand, and gravel eroded from rocks and sediment on land, transported by streams, and deposited in marine deltas and basins. Mostly siliceous in composition."
28,01.01.01.10.02,"Marine sediment, mostly fine-grained","--------Marine sediment, mostly fine-grained","Mostly clay- and silt-sized sediment, deposited in relatively deep, quiet water, far removed from areas where coarser grained clastic sediments are washed into marine environment. Includes sediment derived from marine organisms."
29,01.01.01.11,Mass movement sediment,------Mass movement sediment,"Sediment formed by downslope transport of particles or clasts produced by weathering and breakdown of underlying rock, sediment, and (or) soil. Composed of poorly sorted and poorly stratified material that ranges in size from clay to boulders. Includes colluvial, landslide, talus, and rock-avalanche deposits."
30,01.01.01.11.01,Colluvium and other widespread mass-movement sediment,--------Colluvium and other widespread mass-movement sediment,"Sediment formed by slow, relatively widespread, downslope transport of particles or clasts produced by weathering and breakdown of underlying rock, sediment, and (or) soil. Composed of poorly sorted and poorly stratified material that ranges in size from clay to boulders."
31,01.01.01.11.02,"Debris flows, landslides, and other localized mass-movement sediment","--------Debris flows, landslides, and other localized mass-movement sediment","Sediment formed by relatively localized, downslope transport of particles or clasts produced by weathering and breakdown of underlying rock, sediment, and (or) soil. Composed of poorly sorted and poorly stratified material that ranges in size from clay to boulders. Speed of downslope transport ranges from rapid to imperceptible."
32,01.01.02,Residual material,----Residual material,"Unconsolidated material, developed in place by weathering of underlying rock or sediment. Usually forms relatively thin surface layer that conceals unweathered or partly altered source material. Material from which soils are formed."
33,01.01.03,Carbonate sediment,----Carbonate sediment,"Sediment formed by biotic or abiotic precipitation from aqueous solution of carbonates of calcium, magnesium, or iron (for example, limestone, dolomite)."
34,01.01.04,Peat and muck,----Peat and muck,"Unconsolidated material, principally composed of plant remains, with lesser amounts of fine-grained clastic sediment. Deposited in water-saturated environment such as swamp, marsh, or bog. With lithification, such material becomes coal."
35,01.02,Sedimentary rock,--Sedimentary rock,"Consolidated material (rock) composed of particles transported and deposited by gravity, air, water, or ice, or accumulated by other natural agents operating at Earths surface, such as chemical precipitation or secretion by organisms. Does not here include sedimentary material directly deposited as result of volcanic activity."
36,01.02.01,Clastic sedimentary rock,----Clastic sedimentary rock,"Sedimentary rock, composed predominantly of particles or clasts derived by erosion, weathering, or mass-wasting of preexisting rock and deposited by gravity, air, water, or ice."
37,01.02.01.01,Conglomerate,------Conglomerate,"Sedimentary rock, composed predominantly of particles or clasts derived by erosion and weathering of preexisting rock; contains more than 30 percent gravel-sized clasts."
38,01.02.01.02,Sandstone,------Sandstone,"Sedimentary rock, composed predominantly of particles or clasts derived by erosion and weathering of preexisting rock; consists mostly of sand-sized particles, with or without fine-grained matrix of silt or clay."
39,01.02.01.03,Mostly sandstone,------Mostly sandstone,"Mostly sandstone, interbedded with other sedimentary rocks that locally may include conglomerate and finer grained clastic rocks (mudstone), carbonates, and (or) coal."
40,01.02.01.04,Sandstone and mudstone,------Sandstone and mudstone,"Sandstone and mudstone (including shale and siltstone), in approximately equal (or unspecified) proportions. "
41,01.02.01.05,Mudstone,------Mudstone,"Sedimentary rock, composed predominantly of particles or clasts derived by erosion and weathering of preexisting rock; consists mostly of mud (that is, silt- and clay-sized particles). Includes shale and siltstone."
42,01.02.01.06,Mostly mudstone,------Mostly mudstone,"Mostly mudstone, interbedded with other sedimentary rocks that locally may include coarser grained clastic rocks (sandstone, conglomerate), carbonates, and (or) coal."
43,01.02.02,Carbonate rock,----Carbonate rock,"Sedimentary rock, consisting chiefly of carbonate minerals such as limestone or dolomite. "
44,01.02.02.01,Limestone,------Limestone,"Carbonate sedimentary rock, consisting chiefly of calcite."
45,01.02.02.02,Dolomite,------Dolomite,"Carbonate sedimentary rock, consisting chiefly of dolomite. Although dolostone is the proper analog to limestone, it has not often been applied to dolomitic units."
46,01.02.03,Mostly carbonate rock,----Mostly carbonate rock,"Mostly carbonate rock, interbedded with other sedimentary rock types."
47,01.02.04,Chert,----Chert,"Sedimentary rock, composed chiefly of microcrystalline or cryptocrystalline quartz."
48,01.02.05,Evaporitic rock,----Evaporitic rock,"Sedimentary rock, composed primarily of minerals produced by evaporation of saline solution. Examples include gypsum, anhydrite, other diverse sulfates, halite (rock salt), primary dolomite, and rocks composed of various nitrates and borates."
49,01.02.06,Iron-rich sedimentary rock,----Iron-rich sedimentary rock,"Sedimentary rock, in which at least half (by volume) of observed minerals are iron bearing (hematite, magnetite, limonite group minerals, siderite, iron sulfides)."
50,01.02.07,Coal and lignite,----Coal and lignite,"Organic-rich sedimentary rock, formed from compaction and alteration of plant remains. Coal is consolidated, harder, black rock. Lignite is semiconsolidated, brown to black, earthy material that may contain large particles of recognizable plant parts and tends to crack upon drying."
51,02,Sedimentary and extrusive igneous material,Sedimentary and extrusive igneous material,Either (1) sedimentary rock and (or) unconsolidated material (sediment) and extrusive igneous material (volcanic rock and [or] sediment) or (2) volcanic rock and (or) sediment and such material after erosion and redeposition.
52,03,Igneous rock,Igneous rock,Rock and fragmental material that solidified from molten or partly molten material (magma). 
53,03.01,Extrusive igneous material,--Extrusive igneous material,"Molten material that was erupted onto Earths surface, fusing into rock or remaining as unconsolidated particles. Includes pyroclastic flows, air-fall tephra, lava flows, and volcanic mass flows."
54,03.01.01,Volcaniclastic (fragmental) material,----Volcaniclastic (fragmental) material,Rock and unconsolidated material consisting of particles or clasts that were formed by volcanic explosion or aerial expulsion from volcanic vent.
55,03.01.01.01,Pyroclastic flows,------Pyroclastic flows,"Hot ash, pumice, and rock fragments erupted from volcano or caldera. Material moves downslope commonly in chaotic flows; once deposited, hot fragments may compact under their own weight and weld together."
56,03.01.01.01.01,Felsic-composition pyroclastic flows,--------Felsic-composition pyroclastic flows,"Hot ash, pumice, and rock fragments erupted from volcano or caldera. Material moves downslope commonly in chaotic flows; once deposited, hot fragments may compact under their own weight and weld together. Because of their high-silica content and resulting high viscosity, parental magmas tend to erupt explosively. Includes rhyolite, dacite, trachyte, latite; rocks are commonly light-colored."
57,03.01.01.01.02,Intermediate-composition pyroclastic flows,--------Intermediate-composition pyroclastic flows,"Hot ash, pumice, and rock fragments erupted from volcano. Material moves downslope commonly in chaotic flows; once deposited, hot fragments may compact under their own weight and weld together. Parental magma commonly erupts from stratovolcanoes as thick lava flows but also can generate strong explosive eruptions to form pyroclastic flows. Includes rocks that are, in color and mineral composition, intermediate between felsic and mafic rocks (for example, andesite)."
58,03.01.01.01.03,Mafic-composition pyroclastic flows,--------Mafic-composition pyroclastic flows,"Hot ash, pumice, and rock fragments erupted from volcano. Material moves downslope commonly in chaotic flows; once deposited, hot fragments may compact under their own weight and weld together. Because of their low silica content and resulting low viscosity, parental magmas tend to erupt gently as lava flows rather than more forcefully as pyroclastic flows. Includes basalt; rocks are commonly dark-colored. "
59,03.01.01.02,Air-fall tephra,------Air-fall tephra,"Fragments of volcanic rock and lava, of various sizes, carried into air by explosions and by hot gases in eruption columns or lava fountains; known as tephra. As tephra falls to ground, with increasing distance from volcano, average size of individual rock particles and thickness of resulting deposit decrease. Fine tephra deposited at some distance from volcano is known as volcanic ash."
60,03.01.01.02.01,Felsic-composition air-fall tephra,--------Felsic-composition air-fall tephra,"Fragments of volcanic rock and lava, of various sizes, carried into air by explosions and by hot gases in eruption columns or lava fountains; known as tephra. As tephra falls to ground, with increasing distance from volcano, average size of individual rock particles and thickness of resulting deposit decrease. Because of their high silica content and resulting high viscosity, felsic-composition magmas tend to erupt explosively, readily forming pumice and volcanic ash. Composed of light-colored rocks (for example, rhyolite, dacite, trachyte, latite). "
61,03.01.01.02.02,Intermediate-composition air-fall tephra,--------Intermediate-composition air-fall tephra,"Fragments of volcanic rock and lava, of various sizes, carried into the air by explosions and by hot gases in eruption columns or lava fountains; known as tephra. As tephra falls to ground, with increasing distance from volcano, average size of individual rock particles and thickness of resulting deposit decrease. Parental magma commonly erupts from stratovolcanoes as thick lava flows but also can generate strong explosive eruptions to form pyroclastic flows. Includes rocks that are, in color and mineral composition, intermediate between felsic and mafic rocks (for example, andesite). "
62,03.01.01.02.03,Mafic-composition air-fall tephra,--------Mafic-composition air-fall tephra,"Fragments of volcanic rock and lava, of various sizes, carried into the air by explosions and by hot gases in eruption columns or lava fountains; known as tephra. As tephra falls to ground, with increasing distance from volcano, average size of individual rock particles and thickness of resulting deposit decrease. Because of their low silica content and resulting low viscosity, parental magmas tend to erupt gently as lava flows, and so these deposits are uncommon. Includes basalt; rocks are commonly dark-colored. "
63,03.01.02,Lava flows,----Lava flows,"Lateral, surficial outpourings of molten lava from vent or fissure; also, solidified bodies of rock that form when they cool. Composed generally of fine-grained, dark-colored rocks (for example, basalt), which tend to form extensive sheets that have generally low relief, except in vent areas where cinder cones or shield volcanoes may form. Includes basaltic shield volcanoes, which may become very large (for example, Hawaii)."
64,03.01.02.01,Felsic-composition lava flows,------Felsic-composition lava flows,"Lateral, surficial outpourings of molten lava from vent or fissure; also, solidified bodies of rock that form when they cool. Because of their high silica content and resulting high viscosity, parental magmas tend to erupt explosively, and so these deposits are uncommon. Includes fine-grained, light-colored rock with rhyolitic, dacitic, trachytic, and latitic composition."
65,03.01.02.02,Intermediate-composition lava flows,------Intermediate-composition lava flows,"Lateral, surficial outpourings of molten lava from vent or fissure; also, solidified bodies of rock that form when they cool. Parental magma commonly erupts from stratovolcanoes as thick lava flows. Includes rocks that are, in color and in mineral composition, intermediate between felsic and mafic rocks (for example, andesite)."
66,03.01.02.03,Mafic-composition lava flows,------Mafic-composition lava flows,"Lateral, surficial outpourings of molten lava from vent or fissure; also, solidified bodies of rock that form when they cool. Low-silica parental magmas have low viscosity and tend to form extensive sheets that have generally low relief. Includes basaltic shield volcanoes, which may become very large (for example, in Hawaii). Composed of fine-grained, dark rocks, including basaltic."
67,03.01.03,Volcanic mass flow,----Volcanic mass flow,"Volcanic deposits formed by mass movement (for example, debris avalanches, debris flows, lahar deposits), in many cases triggered by volcanic eruption. Debris avalanches that occur on volcanoes clearly without eruptive trigger may be classified as sedimentary (for example, as Debris flows, landslides, and other localized mass-movement sediment)."
68,03.02,Intrusive igneous rock,--Intrusive igneous rock,Rock that solidified from molten or partly molten material (magma) below Earths surface.
69,03.02.01,Coarse-grained intrusive igneous rock,----Coarse-grained intrusive igneous rock,"Rock that solidified from molten or partly molten material (magma) at some depth beneath Earths surface, thereby cooling slowly enough for mineral crystals to grow large enough to be visible to naked eye."
70,03.02.01.02,"Coarse-grained, felsic-composition intrusive igneous rock","------Coarse-grained, felsic-composition intrusive igneous rock","Rock that solidified from molten or partly molten material (magma) at some depth beneath Earths surface, thereby cooling slowly enough for mineral crystals to grow large enough to be visible to naked eye. Composed mostly of light-colored minerals (for example, feldspar, quartz). Includes granitic, syenitic, and monzonitic rock."
71,03.02.01.03,"Coarse-grained, intermediate-composition intrusive igneous rock","------Coarse-grained, intermediate-composition intrusive igneous rock","Rock that solidified from molten or partly molten material (magma) at some depth beneath Earths surface, thereby cooling slowly enough for mineral crystals to grow large enough to be visible to naked eye. Intermediate in color and in mineral composition (between felsic and mafic igneous rock). Includes dioritic rock."
72,03.02.01.04,"Coarse-grained, mafic-composition intrusive igneous rock","------Coarse-grained, mafic-composition intrusive igneous rock","Rock that solidified from molten or partly molten material (magma) at some depth beneath Earths surface, thereby cooling slowly enough for mineral crystals to grow large enough to be visible to naked eye. Composed mostly of feldspar and dark-colored minerals. Includes gabbroic rock."
73,03.02.01.05,Ultramafic intrusive igneous rock,------Ultramafic intrusive igneous rock,"Rock that solidified from molten or partly molten material (magma) at some depth beneath Earths surface, thereby cooling slowly enough for mineral crystals to grow large enough to be visible to naked eye. Composed almost entirely of mafic minerals (for example, hypersthene, augite, olivine)."
74,03.02.02,Fine-grained intrusive igneous rock,----Fine-grained intrusive igneous rock,"Rock that solidified from molten or partly molten material (magma) at shallow depth beneath Earths surface, thereby cooling quickly. Generally fine grained but may contain large mineral crystals (phenocrysts). Mostly found as tabular dikes or sills."
75,03.02.02.01,"Fine-grained, felsic-composition intrusive igneous rock","------Fine-grained, felsic-composition intrusive igneous rock","Rock that solidified from molten or partly molten material (magma) at shallow depth beneath Earths surface, thereby cooling quickly. Generally fine grained but may contain large mineral crystals (phenocrysts). Mostly found as tabular dikes or sills. Composed mostly of light-colored minerals. Includes rhyolitic, dacitic, trachytic, and latitic rock."
76,03.02.02.02,"Fine-grained, intermediate-composition intrusive igneous rock","------Fine-grained, intermediate-composition intrusive igneous rock","Rock that solidified from molten or partly molten material (magma) at shallow depth beneath Earths surface, thereby cooling quickly. Generally fine grained but may contain large mineral crystals (phenocrysts). Mostly found as tabular dikes or sills. Intermediate in color and in mineral composition (between felsic and mafic igneous rock). Includes andesitic rock."
