OID_,HierarchyKey,GeoMaterial,IndentedName,Definition
77,03.02.02.03,"Fine-grained, mafic-composition intrusive igneous rock","------Fine-grained, mafic-composition intrusive igneous rock","Rock that solidified from molten or partly molten material (magma) at shallow depth beneath Earths surface, thereby cooling quickly. Generally fine grained but may contain large mineral crystals (phenocrysts). Mostly found as tabular dikes or sills. Composed mostly of dark-colored minerals. Includes basaltic rock."
78,03.02.03,Exotic-composition intrusive igneous rock,----Exotic-composition intrusive igneous rock,"Rock that solidified from molten or partly molten material (magma) below Earths surface that has exotic mineralogical, textural, or field setting characteristics. Typically dark colored with abundant phenocrysts. Includes kimberlite, lamprophyre, lamproite, and foiditic rocks."
79,04,Igneous and metamorphic rock,Igneous and metamorphic rock,Consists of coarse-grained intrusive igneous rock and generally medium- to high-grade metamorphic rock.
80,05,Metamorphic rock,Metamorphic rock,"Rock derived from preexisting rocks and altered by essentially solid-state mineralogical, chemical, or structural changes, in response to marked changes in temperature, pressure, deformation, and (or) chemical environment, generally at depth in Earths crust."
81,05.01,"Regional metamorphic rock, of unspecified origin","--Regional metamorphic rock, of unspecified origin","Rock derived from preexisting rocks and altered by essentially solid-state mineralogical, chemical, or structural changes, in response to marked regional changes in temperature, pressure, deformation, and (or) chemical environment, generally at depth in Earths crust. Origin of preexisting rock is mixed (for example, igneous and sedimentary) or is not known. "
82,05.01.01,"Lower-grade metamorphic rock, of unspecified origin","----Lower-grade metamorphic rock, of unspecified origin","Rock derived from preexisting rocks and altered by essentially solid-state mineralogical, chemical, or structural changes, in response to relatively mild regional changes in temperature, pressure, deformation, and (or) chemical environment, generally at depth in Earths crust. Origin of preexisting rock is mixed (for example, igneous and sedimentary) or is not known. Includes slate and phyllite."
83,05.01.02,"Medium and high-grade regional metamorphic rock, of unspecified origin","----Medium and high-grade regional metamorphic rock, of unspecified origin","Rock derived from preexisting rocks and altered by essentially solid-state mineralogical, chemical, or structural changes, in response to relatively intense regional changes in temperature, pressure, deformation, and (or) chemical environment, generally at depth in Earths crust. Origin of preexisting rock is mixed (for example, igneous and sedimentary) or is not known. Includes amphibolite, granulite, schist, and gneiss."
84,05.01.03,Contact-metamorphic rock,----Contact-metamorphic rock,"Altered rock that originated by local processes of thermal metamorphism, genetically related to intrusion and extrusion of magmas and taking place at or near contact with body of igneous rock. Metamorphic changes are effected by heat and fluids emanating from magma and by some deformation because of emplacement of igneous mass."
85,05.01.04,Deformation-related metamorphic rock,----Deformation-related metamorphic rock,"Rock derived from preexisting rocks by essentially solid-state mineralogical, chemical, or structural changes in response to strong deformation, commonly in association with marked changes in temperature, pressure, and (or) chemical environment. Generally forms in narrow, planar zones of local deformation (for example, along faults); characterized by foliation or alignment of mineral grains. Includes mylonite and cataclasite."
86,05.02,Metasedimentary rock,--Metasedimentary rock,"Rock derived from preexisting sedimentary rocks and altered by essentially solid-state mineralogical, chemical, or structural changes, in response to marked changes in temperature, pressure, deformation, and (or) chemical environment, generally at depth in Earths crust."
87,05.02.01,"Slate and phyllite, of sedimentary-rock origin","----Slate and phyllite, of sedimentary-rock origin","Fine-grained rock derived from preexisting sedimentary rocks and altered by essentially solid-state mineralogical, chemical, or structural changes, in response to marked changes in temperature, pressure, deformation, and (or) chemical environment, generally at depth in Earths crust. Includes phyllite and slate (compact, fine-grained rock that possesses strong cleavage and, hence, can be split into slabs and thin plates). Mostly formed from fine-grained material such as mudstone."
88,05.02.02,"Schist and gneiss, of sedimentary-rock origin","----Schist and gneiss, of sedimentary-rock origin","Foliated rock derived from preexisting sedimentary rocks by essentially solid-state mineralogical, chemical, or structural changes in response to marked changes in temperature, pressure, deformation, and (or) chemical environment, generally at depth in Earths crust. Includes schist (characterized by such strong foliation or alignment of minerals that it readily splits into flakes or slabs) and gneiss (characterized by alternating, irregular bands of different mineral composition). Mostly formed from fine-grained material such as mudstone."
89,05.02.03,Meta-carbonate rock,----Meta-carbonate rock,"Rock derived from preexisting carbonate sedimentary rocks and altered by essentially solid-state mineralogical, chemical, or structural changes, in response to marked changes in temperature, pressure, deformation, and (or) chemical environment, generally at depth in Earths crust. Characterized by recrystallization of carbonate minerals in source rock. Includes marble (for which preexisting rock was dominantly limestone or other rock composed of calcite), dolomitic marble, meta-dolostone, and meta-dolomite (for which preexisting rock contained appreciable amount of magnesium)."
90,05.02.04,Quartzite,----Quartzite,"Rock derived from preexisting quartz-rich sedimentary rocks (commonly sandstone) and altered by essentially solid-state mineralogical, chemical, or structural changes, in response to marked changes in temperature, pressure, shear stress, and (or) chemical environment, generally at depth in Earths crust. "
91,05.03,Metaigneous rock,--Metaigneous rock,"Rock derived from preexisting igneous rocks and altered by essentially solid-state, mineralogical, chemical, or structural changes, in response to marked changes in temperature, pressure, shear stress, and (or) chemical environment, generally at depth in Earths crust. "
92,05.03.01,Meta-ultramafic rock,----Meta-ultramafic rock,"Rock derived from preexisting ultramafic rocks by essentially solid-state, mineralogical, chemical, or structural changes, in response to marked changes in temperature, pressure, deformation, and (or) chemical environment, generally at depth in Earths crust. Composed mostly of magnesium-bearing minerals (for example, serpentine, talc, magnesite)."
93,05.03.02,Meta-mafic rock,----Meta-mafic rock,"Rock derived from preexisting mafic rocks by essentially solid-state, mineralogical, chemical, or structural changes, in response to marked changes in temperature, pressure, deformation, and (or) chemical environment, generally at depth in Earths crust. Composed mostly of iron- and magnesium-bearing, dark-colored and (or) green minerals. Includes greenstone, amphibolite, and metagabbro."
94,05.03.03,Meta-felsic and intermediate rock,----Meta-felsic and intermediate rock,"Rock derived from preexisting felsic and intermediate-composition rocks by essentially solid-state, mineralogical, chemical, or structural changes, in response to marked changes in temperature, pressure, deformation, and (or) chemical environment, generally at depth in Earths crust. Composed mostly of light-colored minerals; relatively enriched in silica. Includes metagranite, metadiorite, and meta-andesite."
95,05.03.04,Meta-volcaniclastic rock,----Meta-volcaniclastic rock,"Rock derived from preexisting volcaniclastic rocks by essentially solid-state, mineralogical, chemical, or structural changes, in response to marked changes in temperature, pressure, deformation, and (or) chemical environment, generally at depth in Earths crust. Composed of deformed but recognizable particles or clasts of volcanic explosive material."
96,06,Other materials,Other materials:,
97,06.01,Rock and sediment,--Rock and sediment,"Various rocks and sediment, not differentiated."
98,06.02,Rock,--Rock,"Various rock types, not differentiated."
99,06.03,""Made"" or human-engineered land,--""Made"" or human-engineered land,"Modern, unconsolidated material known to have human-related origin."
100,06.04,Water or ice,--Water or ice,
101,06.05,Unmapped area,--Unmapped area,
